Biography,Category,Spacy_NER,Stanza_NER
"M.S. Krishna Iyer (born 1934 or 1935, Thrissur, Kerala, India), also known as Ambi Swamy, was an Indian chef and a restaurateur. He was instrumental in bringing vegetarian dishes to masses in Kerala from the temples. Swamy started his cooking at the age of 17 and has organised cooking for big programmes like Kerala School Kalolsavam. He died in 2012. He was survived by seven sons and two daughters.",Chefs,"[('Rodolfo Neri Vela', 'PERSON'), ('19 February 1952', 'DATE'), ('Mexican', 'NORP'), ('NASA', 'ORG'), ('the year 1985', 'DATE'), ('second', 'ORDINAL'), ('Latin American', 'NORP')]","[('Rodolfo Neri Vela', 'PERSON'), ('19 February 1952', 'DATE'), ('Mexican', 'NORP'), ('NASA', 'ORG'), ('Space Shuttle', 'PRODUCT'), ('the year 1985', 'DATE'), ('second', 'ORDINAL'), ('Latin American', 'NORP')]"
Nawab Mehboob Alam Khan is an Indian food connoisseur and culinary expert of Hyderabadi cuisine. He has restored many lost recipes of the Hyderabadi tradition.,Chefs,"[('Juliet Corson', 'PERSON'), ('January 14, 1841 – June 18, 1897', 'DATE'), ('the latter half of the 19th century', 'DATE'), ('the United States', 'GPE'), ('weekly', 'DATE'), ('the New York Times', 'ORG'), ('five years', 'DATE'), ('1875–1880', 'CARDINAL')]","[('Juliet Corson', 'PERSON'), ('January 14 , 1841 – June 18 , 1897', 'DATE'), ('the latter half of the 19th century', 'DATE'), ('the United States', 'GPE'), ('weekly', 'DATE'), ('the New York Times', 'ORG'), ('five years', 'DATE'), ('1875–1880', 'DATE')]"
"Melissa Donovan d'Arabian is an American cookbook author and television show host. She won the fifth season of Food Network Star in 2009. Following her victory, she went on to host Ten Dollar Dinners on Food Network.",Chefs,"[('Sara Moulton', 'PERSON'), ('February 19, 1952', 'DATE'), ('American', 'NORP'), ('The New York Times', 'ORG'), ('Kim Severson', 'PERSON'), ('Moulton', 'ORG'), ('Moulton', 'PERSON'), ('Good Morning America', 'WORK_OF_ART'), ('morning', 'TIME'), ('ABC', 'ORG'), ('1997', 'DATE'), ('2012', 'DATE'), ('Gourmet', 'ORG'), ('20 years', 'DATE'), ('2009', 'DATE'), ('Between 1996 and 2005', 'DATE'), ('Moulton', 'ORG'), ('Cooking Live', 'PERSON'), ('1999', 'DATE'), (""Sara's Secrets"", 'ORG'), ('the Food Network', 'ORG'), ('its first decade', 'DATE'), ('nearly 40 years', 'DATE'), ('Moulton', 'ORG'), ('Sara Moulton Cooks', 'PERSON'), ('2002', 'DATE'), (""Sara's Secrets for Weeknight Meals"", 'ORG'), ('2005', 'DATE'), (""Sara Moulton's"", 'PERSON'), ('Everyday Family Dinners', 'ORG'), ('2010', 'DATE'), ('1982', 'DATE'), ('Moulton', 'ORG'), ('2008', 'DATE'), ('Moulton', 'ORG'), (""Sara's"", 'ORG'), ('Weeknight Meals', 'ORG'), ('American Public Television', 'ORG'), ('August 2012 through October 2018', 'DATE'), ('Moulton', 'ORG'), ('weekly', 'DATE'), ('the Associated Press', 'ORG'), ('October 2016', 'DATE'), ('Moulton', 'ORG'), (""Christopher Kimball's"", 'PERSON'), ('Milk Street Radio', 'WORK_OF_ART'), ('weekly', 'DATE'), ('National Public Radio', 'ORG')]","[('Sara Moulton', 'PERSON'), ('February 19 , 1952', 'DATE'), ('American', 'NORP'), ('The New York Times', 'ORG'), ('Kim Severson', 'PERSON'), ('Moulton', 'PERSON'), ('one', 'CARDINAL'), ('Moulton', 'PERSON'), ('Good Morning America', 'ORG'), ('ABC', 'ORG'), ('1997', 'DATE'), ('2012', 'DATE'), ('Gourmet', 'ORG'), ('20 years', 'DATE'), ('2009', 'DATE'), ('Between 1996 and 2005', 'DATE'), ('Moulton', 'PERSON'), ('Cooking Live', 'WORK_OF_ART'), ('1997–2002', 'DATE'), ('Cooking Live Primetime', 'WORK_OF_ART'), ('1999', 'DATE'), (""Sara 's Secrets"", 'WORK_OF_ART'), ('2002–2005', 'DATE'), ('the Food Network', 'ORG'), ('its first decade', 'DATE'), ('nearly 40 years', 'DATE'), ('Moulton', 'PERSON'), ('Sara Moulton Cooks at Home', 'ORG'), ('2002', 'DATE'), (""Sara 's Secrets for Weeknight Meals"", 'WORK_OF_ART'), ('2005', 'DATE'), (""Sara Moulton 's"", 'PERSON'), ('Everyday Family Dinners', 'WORK_OF_ART'), ('2010', 'DATE'), ('1982', 'DATE'), ('Moulton co', 'ORG'), ('2008', 'DATE'), ('Moulton', 'PERSON'), (""Sara 's Weeknight Meals"", 'ORG'), ('American Public Television', 'ORG'), ('August 2012 through October 2018', 'DATE'), ('Moulton', 'PERSON'), ('weekly', 'DATE'), ('the Associated Press', 'ORG'), ('October 2016', 'DATE'), ('Moulton', 'PERSON'), (""Christopher Kimball 's"", 'PERSON'), ('"" Milk Street Radio ""', 'WORK_OF_ART'), ('weekly', 'DATE'), ('National Public Radio', 'ORG')]"
Omar Allibhoy is a Spanish celebrity chef. He has previously worked at elBulli under Ferran Adrià and under Jason Atherton. He is the founder of the Tapas Revolution group. He opened his first restaurant at Westfield London in 2011.,Chefs,"[('French', 'NORP'), ('22', 'CARDINAL'), ('August 1971', 'DATE'), ('31 January 2016', 'DATE'), ('French', 'NORP'), ('Violier', 'ORG'), ('three', 'CARDINAL'), ('Michelin', 'ORG'), (""Restaurant de l'Hôtel de Ville"", 'PERSON'), ('Lausanne', 'GPE'), ('Switzerland', 'GPE'), ('2012', 'DATE'), ('first', 'ORDINAL'), ('La Liste', 'ORG'), ('December 2015', 'DATE')]","[('Benoît Violier', 'PERSON'), ('French', 'NORP'), ('22 August 1971', 'DATE'), ('31 January 2016', 'DATE'), ('French', 'NORP'), ('Swiss', 'NORP'), ('Violier', 'ORG'), ('three', 'CARDINAL'), ('Michelin', 'ORG'), (""Restaurant de l'Hôtel de Ville"", 'FAC'), ('Lausanne', 'GPE'), ('Switzerland', 'GPE'), ('2012', 'DATE'), ('first', 'ORDINAL'), ('La Liste', 'ORG'), ('December 2015', 'DATE')]"
"Priya Krishna is an Indian-American food journalist and YouTube personality. She is a food reporter for The New York Times and has previously contributed to The New Yorker, Eater, and TASTE (as a columnist). She is also the author of multiple cookbooks, including Indian-ish, a cookbook she wrote with her mother. Krishna previously worked for Bon Appétit and appeared on their popular YouTube channel from 2018 to 2020. Before that, she also worked in the marketing department of Lucky Peach , a food magazine established by David Chang. In 2021, she co-authored a cookbook together with Chang titled Cooking at Home: Or, How I Learned to Stop Worrying About Recipes (And Love My Microwave).",Chefs,"[('Brad Farmerie', 'PERSON'), ('New York City', 'GPE'), ('AvroKO Hospitality Group', 'ORG')]","[('Brad Farmerie', 'PERSON'), ('Public and Saxon + Parole', 'ORG'), ('New York City', 'GPE'), ('AvroKO Hospitality Group', 'ORG')]"
"Sarah Kramer is a Canadian vegan cookbook author. She is the best-selling author of How It All Vegan, The Garden of Vegan, La Dolce Vegan! and Vegan A Go-Go!. In 2012, she released Go Vegan! w/Sarah Kramer, one of the world's first vegan cookbook iPhone/iPad apps. Kramer has written for publications such as Herbivore Magazine, Veg News and Shared Vision. She runs a popular vegan website/blog at govegan.net. She had a small vegan boutique called Sarah's Place that opened in 2011 and closed 2 years later after a diagnosis of breast cancer. Sarah did treatment in 2013 and now works full time at the business Tattoo Zoo that she co-owns with her wife, Geri Kramer in Victoria, BC. Sarah and Geri have a podcast called Meet The Kramers in which they discuss their 25-year marriage in relation to Geri's coming out as a trans woman in 2019.",Chefs,"[('Sarah Kramer', 'PERSON'), ('Canadian', 'NORP'), ('The Garden of Vegan', 'FAC'), ('La Dolce', 'PERSON'), ('Vegan A Go-Go', 'ORG'), ('2012', 'DATE'), ('Sarah Kramer', 'PERSON'), ('one', 'CARDINAL'), ('first', 'ORDINAL'), ('Kramer', 'PERSON'), ('Herbivore Magazine', 'ORG'), ('Veg News', 'ORG'), ('Shared Vision', 'ORG'), ('Sarah', 'PERSON'), ('2011', 'DATE'), ('2 years later', 'DATE'), ('Sarah', 'PERSON'), ('2013', 'DATE'), ('Tattoo Zoo', 'PERSON'), ('Geri Kramer', 'PERSON'), ('Victoria', 'GPE'), ('BC', 'ORG'), ('Sarah', 'PERSON'), ('Geri', 'PERSON'), ('Meet The Kramers', 'ORG'), ('25-year', 'DATE'), ('Geri', 'PRODUCT'), ('2019', 'DATE')]","[('Sarah Kramer', 'PERSON'), ('Canadian', 'NORP'), ('How It All Vegan', 'WORK_OF_ART'), ('The Garden of Vegan', 'WORK_OF_ART'), ('Vegan A Go - Go', 'WORK_OF_ART'), ('2012', 'DATE'), ('Go Vegan', 'WORK_OF_ART'), ('Sarah Kramer', 'PERSON'), ('first', 'ORDINAL'), ('iPhone', 'PRODUCT'), ('iPad', 'PRODUCT'), ('Kramer', 'PERSON'), ('Herbivore Magazine', 'ORG'), ('Veg News', 'ORG'), ('Shared Vision', 'WORK_OF_ART'), (""Sarah 's Place"", 'FAC'), ('2011', 'DATE'), ('2 years later', 'DATE'), ('Sarah', 'PERSON'), ('2013', 'DATE'), ('Tattoo Zoo', 'ORG'), ('Geri Kramer', 'PERSON'), ('Victoria , BC', 'GPE'), ('Sarah', 'PERSON'), ('Geri', 'PERSON'), ('Meet The Kramers', 'WORK_OF_ART'), ('25 - year', 'DATE'), ('Geri', 'PERSON'), ('2019', 'DATE')]"
"Belinda Leong is an American pastry chef who is the co-founder and owner of b. Patisserie in San Francisco. Leong began her culinary career with an internship at Michael Mina's Aqua Restaurant and enrolled in the Hospitality and Restaurant Program at San Francisco City College. After graduating in 1999, she joined Gary Danko, becoming the pastry chef there in 2001. After eight years at Gary Danko, Leong sought more experience in Europe, staging with Pierre Hermé in Paris, with Carles Mampel at Bubó, Martín Berasategui at Lasarte, René Redzepi at Noma, and at In De Wulf in Belgium. After two years in Europe, she returned to the Bay Area to become the pastry chef at Manresa. In 2013, Leong partnered with Michel Suas of the San Francisco Baking Institute to open b. Patisserie in San Francisco. Her Kouign-amann became a favorite among customers and received praise from national publications. Leong was nominated for James Beard Foundation Awards for Outstanding Pastry Chef in 2014, and Outstanding Baker in 2015, 2016, and 2017. In 2018, she won the James Beard Award for Outstanding Baker along with her partner, Michel Suas.",Chefs,"[('Rochelle Adonis', 'PERSON'), ('Canadian', 'NORP'), ('Australian', 'NORP'), ('restaurateur', 'ORG'), ('the first two seasons', 'DATE'), ('The Great Canadian Baking Show', 'ORG'), ('French', 'NORP'), ('Canadian', 'NORP'), ('Bruno Feldeisen', 'PERSON')]","[('Rochelle Adonis', 'PERSON'), ('Canadian', 'NORP'), ('Australian', 'NORP'), ('the first two seasons', 'DATE'), ('The Great Canadian Baking Show', 'WORK_OF_ART'), ('French', 'LANGUAGE'), ('Canadian', 'NORP'), ('Bruno Feldeisen', 'PERSON')]"
Benjamin O'Donoghue (born 22 May 1970) is an Australian chef.,Chefs,"[('Ruscalleda', 'PERSON'), ('Serra (Catalan', 'ORG'), ('1952', 'DATE'), ('Spanish', 'NORP'), ('Sant Pau', 'PERSON'), ('Sant Pol de Mar', 'PERSON'), ('Barcelona', 'GPE'), ('Catalonia', 'GPE'), ('Spain', 'GPE'), ('Sant Pau de Tòquio', 'PERSON'), ('Japan', 'GPE'), ('Ruscalleda', 'PERSON'), ('Charcuterie', 'PERSON'), ('Commerce', 'ORG'), ('Toni Balam', 'PERSON'), ('1975', 'DATE'), ('Sant Pau', 'PERSON'), ('1988', 'DATE'), ('1991', 'DATE'), ('first', 'ORDINAL'), ('Michelin Guide', 'ORG'), ('2006', 'DATE'), ('third', 'ORDINAL'), ('Michelin', 'PERSON'), ('Today', 'DATE'), ('seven', 'CARDINAL'), ('Michelin', 'PERSON'), ('three', 'CARDINAL'), ('Catalonia', 'GPE'), ('two', 'CARDINAL'), ('the Sant Pau', 'ORG'), ('Tokyo', 'GPE'), ('two', 'CARDINAL'), ('Mandarin', 'NORP'), ('only seven', 'CARDINAL'), ('Sant Pol de Mar', 'PERSON'), ('three', 'CARDINAL'), ('1999', 'DATE'), ('Catalan', 'NORP'), ('2000', 'DATE'), ('Mediterranean', 'LOC'), ('Cuinar', 'PERSON'), ('2001', 'DATE'), ('Cooking', 'PERSON'), ('English', 'LANGUAGE'), (""Carme Ruscalleda's"", 'PERSON'), ('Mediterranean', 'LOC'), ('2007', 'DATE'), ('Salsa Books Editions', 'WORK_OF_ART'), ('Moments', 'GPE'), ('the Mandarin Oriental', 'ORG'), ('Barcelona', 'GPE'), ('2', 'CARDINAL'), ('Michelin', 'PERSON'), ('Raül Balam', 'PERSON')]","[('Carme Ruscalleda i Serra', 'PERSON'), ('Catalan', 'NORP'), ('1952', 'DATE'), ('Spanish', 'NORP'), ('Sant Pau', 'FAC'), ('Sant Pol de Mar', 'GPE'), ('Barcelona', 'GPE'), ('Catalonia', 'GPE'), ('Spain', 'GPE'), ('Sant Pau de Tòquio', 'FAC'), ('Japan', 'GPE'), ('Ruscalleda', 'PERSON'), ('Charcuterie', 'WORK_OF_ART'), ('Commerce', 'ORG'), ('Toni Balam', 'PERSON'), ('1975', 'DATE'), ('Sant Pau', 'FAC'), ('1988', 'DATE'), ('1991', 'DATE'), ('first', 'ORDINAL'), ('Michelin Guide', 'ORG'), ('2006', 'DATE'), ('third', 'ORDINAL'), ('Michelin', 'ORG'), ('Today', 'DATE'), ('seven', 'CARDINAL'), ('Michelin', 'WORK_OF_ART'), ('three', 'CARDINAL'), ('Catalonia', 'GPE'), ('two', 'CARDINAL'), ('the Sant Pau', 'FAC'), ('Tokyo', 'GPE'), ('two', 'CARDINAL'), ('Moments Restaurant', 'WORK_OF_ART'), ('the Mandarin Oriental Barcelona', 'WORK_OF_ART'), ('2016', 'DATE'), ('seven', 'CARDINAL'), ('Michelin', 'ORG'), ('Sant Pol de Mar', 'GPE'), ('three', 'CARDINAL'), ('1999', 'DATE'), ('Catalan', 'NORP'), ('2000', 'DATE'), ('Mediterranean', 'NORP'), ('Cuinar per ser feliç', 'WORK_OF_ART'), ('2001', 'DATE'), ('English', 'LANGUAGE'), (""Carme Ruscalleda 's"", 'PERSON'), ('Mediterranean', 'NORP'), ('2007', 'DATE'), ('Salsa Books Editions', 'WORK_OF_ART'), ('Moments', 'FAC'), ('the Mandarin Oriental', 'ORG'), ('Barcelona', 'GPE'), ('2', 'CARDINAL'), ('Michelin', 'ORG'), ('Raül Balam', 'PERSON')]"
"Ben Pollinger is the former executive chef of Oceana restaurant in New York City, a Michelin star recipient.",Chefs,"[('Alam Khan', 'PERSON'), ('Indian', 'NORP')]","[('Nawab Mehboob Alam Khan', 'PERSON'), ('Indian', 'NORP'), ('Hyderabadi', 'NORP'), ('Hyderabadi', 'NORP')]"
Ben Shewry (born 1977) is a New Zealand chef and owner of Attica restaurant in Melbourne.,Chefs,"[('Ronald Anthony Parise', 'PERSON'), ('May 24, 1951', 'DATE'), ('May 9, 2008', 'DATE'), ('Italian', 'NORP'), ('American', 'NORP'), ('two', 'CARDINAL'), ('NASA', 'ORG'), ('Warren', 'GPE'), ('Ohio', 'GPE'), ('Henry', 'GPE'), ('Catherine Parise', 'PERSON'), ('Pasha', 'PERSON'), ('age 11', 'DATE'), ('Western Reserve High School', 'ORG'), ('1969', 'DATE'), ('Youngstown State University', 'ORG'), ('1973', 'DATE'), ('1977', 'DATE'), ('1979', 'DATE'), ('the University of Florida', 'ORG'), ('Cecelia Sokol Parise', 'PERSON'), ('two', 'CARDINAL'), ('May 9, 2008', 'DATE'), ('the age of 56', 'DATE')]","[('Ronald Anthony Parise', 'PERSON'), ('May 24 , 1951', 'DATE'), ('May 9 , 2008', 'DATE'), ('Italian', 'NORP'), ('American', 'NORP'), ('two', 'CARDINAL'), ('NASA', 'ORG'), ('Space Shuttle', 'PRODUCT'), ('Parise', 'PERSON'), ('Warren', 'GPE'), ('Ohio', 'GPE'), ('Henry', 'PERSON'), ('Catherine Parise', 'PERSON'), ('Pasha', 'PERSON'), ('age 11', 'DATE'), ('Western Reserve High School', 'ORG'), ('1969', 'DATE'), ('Youngstown State University', 'ORG'), ('1973', 'DATE'), (""a master 's degree"", 'WORK_OF_ART'), ('1977', 'DATE'), ('1979', 'DATE'), ('the University of Florida', 'ORG'), ('Cecelia Sokol Parise', 'PERSON'), ('two', 'CARDINAL'), ('Parise', 'PERSON'), ('May 9 , 2008', 'DATE'), ('the age of 56', 'DATE')]"
"Benedetto D'Epiro (born 26 April 1977 in Rome), better known as “Benny the Chef!”, is an Italian chef, culinary teacher, book author, awards winner, television personality and entertainer.",Chefs,"[('David Chang', 'PERSON'), ('Korean', 'NORP'), ('Chang Seok-ho', 'PERSON'), ('August 5, 1977', 'DATE'), ('American', 'NORP'), ('Momofuku', 'GPE'), ('2009', 'DATE'), ('Momofuku Ko', 'PERSON'), ('two', 'CARDINAL'), ('Michelin', 'PERSON'), ('each year', 'DATE'), ('Lucky Peach', 'PERSON'), ('2011', 'DATE'), ('25', 'CARDINAL'), ('quarterly', 'DATE'), ('2017', 'DATE'), ('2018', 'DATE'), ('Chang', 'PERSON'), ('Netflix', 'GPE'), ('Majordomo Media', 'ORG'), ('November 29, 2020', 'DATE'), ('first', 'ORDINAL'), ('1,000,000', 'MONEY'), ('Southern Smoke Foundation', 'ORG'), ('million dollar', 'MONEY')]","[('David Chang', 'PERSON'), ('Korean', 'NORP'), ('Chang Seok - ho', 'PERSON'), ('August 5 , 1977', 'DATE'), ('American', 'NORP'), ('Momofuku', 'ORG'), ('2009', 'DATE'), ('Momofuku Ko', 'PERSON'), ('two', 'CARDINAL'), ('Michelin', 'ORG'), ('Lucky Peach', 'ORG'), ('2011', 'DATE'), ('25 quarterly', 'DATE'), ('2017', 'DATE'), ('2018', 'DATE'), ('Chang', 'PERSON'), ('Netflix', 'ORG'), ('Ugly Delicious', 'WORK_OF_ART'), ('Majordomo Media', 'ORG'), ('November 29 , 2020', 'DATE'), ('first', 'ORDINAL'), ('1,000,000', 'MONEY'), ('Southern Smoke Foundation', 'ORG'), ('fourteenth', 'ORDINAL'), ('million dollar', 'MONEY'), ('Who Wants to Be a Millionaire', 'WORK_OF_ART')]"
"Benoît Violier (French pronunciation: ​[bənwa vjɔlje]; 22 August 1971 – 31 January 2016) was a French-Swiss chef . Violier owned the three Michelin star Restaurant de l'Hôtel de Ville in a suburb of Lausanne, Switzerland from 2012 to his death. The establishment topped the first La Liste in December 2015.",Chefs,"[('David Alexander Wolf', 'PERSON'), ('August 23, 1956', 'DATE'), ('American', 'NORP'), ('Wolf', 'PERSON'), ('four', 'CARDINAL'), ('Three', 'CARDINAL'), ('Space Shuttle', 'PERSON'), ('first', 'ORDINAL'), ('1993', 'DATE'), ('2009', 'DATE'), ('Wolf', 'PERSON'), ('Russian', 'NORP'), ('Mir', 'FAC'), ('128 days', 'DATE'), ('Mir', 'FAC'), ('Mir', 'FAC'), ('September 1997', 'DATE'), ('January 1998', 'DATE'), ('Wolf', 'PERSON'), ('more than 4,040 hours', 'TIME'), ('7', 'CARDINAL'), ('41hrs 17min', 'CARDINAL'), ('Russian', 'NORP'), ('American', 'NORP')]","[('David Alexander Wolf', 'PERSON'), ('August 23 , 1956', 'DATE'), ('American', 'NORP'), ('Wolf', 'PERSON'), ('four', 'CARDINAL'), ('Three', 'CARDINAL'), ('Space Shuttle', 'PRODUCT'), ('first', 'ORDINAL'), ('1993', 'DATE'), ('2009', 'DATE'), ('Wolf', 'PERSON'), ('Russian', 'NORP'), ('Mir', 'FAC'), ('128 days', 'DATE'), ('Mir EO-24', 'FAC'), ('Mir', 'FAC'), ('September 1997', 'DATE'), ('STS-89', 'PRODUCT'), ('January 1998', 'DATE'), ('Wolf', 'PERSON'), ('more than 4,040 hours', 'TIME'), ('7', 'CARDINAL'), ('41hrs 17min', 'QUANTITY'), ('Russian', 'NORP'), ('American', 'NORP')]"
"Bent Stiansen (born 18 June 1963 in Arendal, Norway ) is a Norwegian chef, who in 1993 became the first Scandinavian gold medal winner of the Bocuse d'Or. In 1994, with his Danish wife Anette, he established the restaurant Statholdergaarden in Oslo, which they ran together until her death in May 2010. It is merited with one Michelin star, and its wine selection rated ""Best of Award of Excellence"" by Wine Spectator. In conjunction with the restaurant, located beneath there is also a more informal restaurant, Statholderens Mat & vinkjeller, at the former Oslo lodgings of Tordenskjold.",Chefs,"[('David Carmichael', 'PERSON'), ('American', 'NORP'), ('New York', 'GPE'), ('Manhattan', 'GPE'), ('the New York Palace Hotel', 'ORG')]","[('David Carmichael', 'PERSON'), ('American', 'NORP'), ('New York', 'GPE'), ('Manhattan', 'GPE'), ('Gilt', 'ORG'), ('the New York Palace Hotel', 'FAC')]"
"Bernard Daniel Jacques Loiseau (French pronunciation: ​[bɛʁnaʁ danjɛl ʒak lwazo], 13 January 1951 – 24 February 2003) was a French chef at Le Relais Bernard Loiseau in Saulieu. He obtained his three stars in the Michelin Guide, and had a peak rating of 19.5/20 in the Gault Millau restaurant guide. He was one of the most mediatised French chefs between the 1980s and 1990s. In 2003, a short time after having become a member of the Relais & Châteaux association, Loiseau was downgraded from 19/20 to 17/20 in the Gault et Millau guide and received a strong negative media review from the gastronomic critic François Simon in the newspaper Le Figaro, but he still had his three stars in the Michelin Guide. As criticism continued to pour in and while the medias speculated about a possible future loss of a Michelin star, he died by suicide by self-inflicted gunshot without giving any explanation. The theories aiming at explaining his death are the object of strong polemics. His decision was likely due to increased bouts of clinical depression.",Chefs,"[('Judy Joo', 'PERSON'), (""Food Network's"", 'ORG'), ('Korean Food Made Simple', 'WORK_OF_ART'), ('UK', 'GPE'), ('Seoul Bird', 'ORG'), ('London', 'GPE'), ('Joo', 'PERSON'), ('New York City', 'GPE'), ('London', 'GPE'), ('Asia', 'LOC')]","[('Judy Joo', 'PERSON'), (""Food Network 's"", 'ORG'), ('Korean Food Made Simple ""', 'WORK_OF_ART'), ('an Iron Chef UK', 'WORK_OF_ART'), ('Seoul Bird', 'ORG'), ('London', 'GPE'), ('Joo', 'PERSON'), ('New York City', 'GPE'), ('London', 'GPE'), ('Asia', 'LOC')]"
"Elizabeth ""Betty"" R. Groff (née Herr, September 14, 1935 – November 8, 2015) was an American celebrity chef, cookbook author, and authority on Pennsylvania Dutch cuisine. Groff authored six cookbooks focusing on Pennsylvania Dutch foods, including Good Earth and Country Cooking, which Time magazine called ""one of the top five regional cookbooks introduced in 1981."" In 2015, The Patriot-News further praised her contributions to regional food traditions, writing ""Groff was to Pennsylvania Dutch food what the late chef Paul Prudhomme was to Cajun cooking."" Groff was born in Strasburg, Pennsylvania, to Clarence N. and Bertha K. Root Herr. She was a 10th generation Pennsylvania Mennonite and a direct descendant of Hans Herr. She married her husband, Abram B. Groff, on November 12, 1955. In November 2014, The New York Times selected Groff's recipe for glazed bacon to represent Pennsylvania in a survey of Thanksgiving foods from all 50 U.S. states. Betty Groff died on November 8, 2015, at the age of 80.",Chefs,"[('Jonnie Boer', 'PERSON'), ('January 9, 1965', 'DATE'), ('Giethoorn', 'GPE'), ('Dutch', 'NORP'), ('Michelin', 'PERSON'), ('De Librije', 'ORG'), ('Zwolle', 'GPE'), ('Netherlands', 'GPE'), ('Thérèse', 'ORG'), ('3', 'CARDINAL'), ('De Librije', 'ORG'), ('16th century', 'DATE'), (""Librije's Winkel"", 'PERSON'), (""Librije's Hotel and Librije's Atelier"", 'ORG'), ('1989', 'DATE'), ('De Librije', 'ORG'), ('1992', 'DATE'), ('Michelin', 'PERSON'), ('first', 'ORDINAL'), ('1993', 'DATE'), ('Five years later', 'DATE'), ('Michelin', 'PERSON'), ('Jonnie Boer', 'PERSON'), ('second', 'ORDINAL'), ('2004', 'DATE'), ('third', 'ORDINAL'), ('Jonnie Boer', 'PERSON')]","[('Jonnie Boer', 'PERSON'), ('January 9 , 1965', 'DATE'), ('Giethoorn', 'GPE'), ('Dutch', 'NORP'), ('Michelin', 'ORG'), ('De Librije', 'ORG'), ('Zwolle', 'GPE'), ('Netherlands', 'GPE'), ('Thérèse Boer', 'PERSON'), ('3', 'CARDINAL'), ('De Librije', 'WORK_OF_ART'), ('16th century', 'DATE'), (""Librije 's Winkel"", 'ORG'), (""Librije 's Hotel"", 'FAC'), (""Librije 's Atelier"", 'FAC'), ('1989', 'DATE'), ('Boer', 'PERSON'), ('De Librije', 'ORG'), ('1992', 'DATE'), ('Michelin', 'ORG'), ('first', 'ORDINAL'), ('1993', 'DATE'), ('Five years later', 'DATE'), ('Michelin', 'ORG'), ('Jonnie Boer', 'PERSON'), ('second', 'ORDINAL'), ('2004', 'DATE'), ('Boer', 'PERSON'), ('third', 'ORDINAL'), ('Jonnie Boer', 'PERSON')]"
"Biba Caggiano (October 18, 1936 – August 29, 2019) was an Italian-American cookbook author, television chef, and restaurateur.",Chefs,"[('Bertalan Farkas', 'ORG'), ('August 2, 1949', 'DATE'), ('first', 'ORDINAL'), ('Hungarian', 'NORP'), ('Hungary', 'GPE'), ('seventh', 'ORDINAL'), ('Farkas', 'ORG'), ('first', 'ORDINAL'), ('Esperantist', 'NORP'), ('Airlines Service and Trade', 'ORG'), ('Hungarian', 'NORP'), ('Simonyi', 'PERSON'), ('Charles Simonyi', 'PERSON'), ('second', 'ORDINAL'), ('Hungarian', 'NORP'), ('Hungarian', 'NORP'), ('the International Space Station', 'ORG'), ('2025', 'DATE')]","[('Bertalan Farkas', 'PERSON'), ('August 2 , 1949', 'DATE'), ('first', 'ORDINAL'), ('Hungarian', 'NORP'), ('Hungary', 'GPE'), ('seventh', 'ORDINAL'), ('Farkas', 'PERSON'), ('first', 'ORDINAL'), ('Esperantist', 'NORP'), ('Airlines Service and Trade', 'ORG'), ('Hungarian - American', 'NORP'), ('Károly Simonyi', 'PERSON'), ('Charles Simonyi', 'PERSON'), ('second', 'ORDINAL'), ('Hungarian', 'NORP'), ('Hungarian', 'NORP'), ('the International Space Station', 'FAC'), ('2025', 'DATE')]"
"Thomas Hylton ""Bill"" Collins (11 July 1931 – 3 March 2021) was a British baker who, with George Elton and Norman Chamberlain, developed the Chorleywood bread process at the British Baking Industries Research Association in Chorleywood. He was awarded the Queen Elizabeth II Silver Jubilee Medal in 1978.",Chefs,"[('Homaro ""Omar"" Cantu Jr.', 'PERSON'), ('September 23, 1976', 'DATE'), ('April 14, 2015', 'DATE'), ('American', 'NORP'), ('1999', 'DATE'), ('Chicago', 'GPE'), ('Charlie Trotter', 'PERSON'), ('2003', 'DATE'), ('first', 'ORDINAL'), ('Moto', 'ORG'), ('Moto', 'ORG'), ('Moto', 'ORG'), ('2012', 'DATE'), ('Michelin', 'PERSON'), ('Cantu', 'ORG'), ('second', 'ORDINAL'), ('Berrista', 'ORG'), ('Crooked Fork', 'ORG'), ('2015', 'DATE'), ('Cantu', 'ORG'), ('2010', 'DATE'), ('Future Food', 'ORG'), ('berry', 'PERSON')]","[('Homaro "" Omar "" Cantu Jr.', 'PERSON'), ('September 23 , 1976', 'DATE'), ('April 14 , 2015', 'DATE'), ('American', 'NORP'), ('Cantu', 'PERSON'), ('1999', 'DATE'), ('Chicago', 'GPE'), ('Charlie Trotter', 'PERSON'), ('2003', 'DATE'), ('Cantu', 'PERSON'), ('first', 'ORDINAL'), ('Moto', 'PRODUCT'), ('Moto', 'ORG'), ('Cantu', 'PERSON'), ('Moto', 'ORG'), ('2012', 'DATE'), ('Michelin', 'ORG'), ('Cantu', 'PERSON'), ('second', 'ORDINAL'), ('iNG', 'ORG'), ('Berrista', 'ORG'), ('Crooked Fork', 'LOC'), ('2015', 'DATE'), ('Cantu', 'PERSON'), ('2010', 'DATE'), ('Future Food', 'WORK_OF_ART'), ('Cantu', 'PERSON')]"
"William Granger is a self-taught cook, restaurateur and food writer, based in his native Australia and in London but also working internationally.",Chefs,"[('Scott Leibfried', 'PERSON'), ('March 9, 1971', 'DATE'), ('American', 'NORP'), ('the Food Network Challenge', 'ORG'), ('New York City', 'GPE'), ('two', 'CARDINAL')]","[('Scott Leibfried', 'PERSON'), ('March 9 , 1971', 'DATE'), ('American', 'NORP'), (""Hell 's Kitchen"", 'WORK_OF_ART'), ('the Food Network Challenge', 'WORK_OF_ART'), ('Leibfried', 'PERSON'), ('New York City', 'GPE'), ('two', 'CARDINAL')]"
